{
  "event_id": "evt_test_001",
  "event_type": "image.uploaded",
  "source": "basic_site_agent",
  "created_at": "2026-01-01T12:00:00Z",
  "data": {
    "image_url": "https://example.com/demo-image.jpg",
    "filename": "demo-image.jpg",
    "mime_type": "image/jpeg",
    "size_bytes": 850000
  }
}
